{
  "schema_version": "career.resume_analysis_replacement_review_input.v1",
  "expected_analysis_policy_version": "resume_analysis_v1",
  "resume": {
    "schema_version": "career.resume_input.v1",
    "text": "Morgan Lee\nmorgan.lee@example.com\n+1 555 010 0200\nhttps://example.com/morgan\nSUMMARY\nBackend engineer building reliable local services.\nEXPERIENCE\nPlatform Engineer at Acme Corp\n2021 - Present\n- Built reliable APIs for internal teams.\n- Reduced deployment failures by 30 percent.\nEDUCATION\nBachelor of Science in Computer Science, Example University\n2016 - 2020\nSKILLS\nRust, PostgreSQL, Docker, Testing, Git\nPROJECTS\nLocal Career Tool\nBuilt a private deterministic analysis workflow.\nCERTIFICATIONS\nCloud Engineering Certificate\nExample Institute",
    "metadata": {
      "document_id": "synthetic-phase7-analysis-replacements-v1"
    }
  },
  "proposal": {
    "schema_version": "career.resume_analysis_replacement_proposal.v1",
    "replacements": [
      {
        "basis_check_id": "measurable_impact_in_bullets",
        "start_line": 10,
        "end_line": 10,
        "source_target": "- Built reliable APIs for internal teams.",
        "source_evidence": [
          "Built reliable APIs for internal teams.",
          "Reduced deployment failures by 30 percent."
        ],
        "proposed_replacement": "- Built reliable APIs for internal teams, improving deployment reliability by 30 percent."
      }
    ]
  }
}
